{
  "schemaVersion": "1.0.0",
  "assessedAt": "2026-07-25",
  "coverageResolution": "For every jurisdiction, coverageProfiles[coverageProfile] is the complete effective per-dimension status object. There is no implicit parent inheritance. overallStatus is deliberately pessimistic and is not computed from record counts.",
  "coverageStatuses": [
    "Verified broad coverage",
    "Verified partial coverage",
    "Source available but not yet ingested",
    "Structurally supported but unpopulated",
    "Unknown",
    "Excluded, with reason"
  ],
  "dimensions": [
    "protected_areas",
    "natural_features",
    "established_trail_routes",
    "trail_network",
    "access_points",
    "scenic_roads",
    "transport_connections",
    "dynamic_conditions",
    "names_localization",
    "accessibility",
    "licensing_provenance",
    "sensitive_location_controls"
  ],
  "coverageProfiles": {
    "unknown": {
      "protected_areas": "Unknown",
      "natural_features": "Unknown",
      "established_trail_routes": "Unknown",
      "trail_network": "Unknown",
      "access_points": "Unknown",
      "scenic_roads": "Unknown",
      "transport_connections": "Unknown",
      "dynamic_conditions": "Unknown",
      "names_localization": "Unknown",
      "accessibility": "Unknown",
      "licensing_provenance": "Unknown",
      "sensitive_location_controls": "Unknown"
    },
    "eu_base_sources": {
      "protected_areas": "Source available but not yet ingested",
      "natural_features": "Unknown",
      "established_trail_routes": "Unknown",
      "trail_network": "Unknown",
      "access_points": "Unknown",
      "scenic_roads": "Unknown",
      "transport_connections": "Unknown",
      "dynamic_conditions": "Unknown",
      "names_localization": "Source available but not yet ingested",
      "accessibility": "Unknown",
      "licensing_provenance": "Source available but not yet ingested",
      "sensitive_location_controls": "Unknown"
    },
    "uk_base_sources": {
      "protected_areas": "Source available but not yet ingested",
      "natural_features": "Source available but not yet ingested",
      "established_trail_routes": "Unknown",
      "trail_network": "Unknown",
      "access_points": "Source available but not yet ingested",
      "scenic_roads": "Unknown",
      "transport_connections": "Source available but not yet ingested",
      "dynamic_conditions": "Unknown",
      "names_localization": "Source available but not yet ingested",
      "accessibility": "Unknown",
      "licensing_provenance": "Source available but not yet ingested",
      "sensitive_location_controls": "Unknown"
    },
    "scotland_sources": {
      "protected_areas": "Source available but not yet ingested",
      "natural_features": "Source available but not yet ingested",
      "established_trail_routes": "Source available but not yet ingested",
      "trail_network": "Source available but not yet ingested",
      "access_points": "Source available but not yet ingested",
      "scenic_roads": "Unknown",
      "transport_connections": "Source available but not yet ingested",
      "dynamic_conditions": "Source available but not yet ingested",
      "names_localization": "Source available but not yet ingested",
      "accessibility": "Source available but not yet ingested",
      "licensing_provenance": "Source available but not yet ingested",
      "sensitive_location_controls": "Unknown"
    },
    "us_federal_sources": {
      "protected_areas": "Source available but not yet ingested",
      "natural_features": "Source available but not yet ingested",
      "established_trail_routes": "Source available but not yet ingested",
      "trail_network": "Source available but not yet ingested",
      "access_points": "Unknown",
      "scenic_roads": "Unknown",
      "transport_connections": "Unknown",
      "dynamic_conditions": "Source available but not yet ingested",
      "names_localization": "Source available but not yet ingested",
      "accessibility": "Unknown",
      "licensing_provenance": "Source available but not yet ingested",
      "sensitive_location_controls": "Unknown"
    },
    "canada_federal_sources": {
      "protected_areas": "Source available but not yet ingested",
      "natural_features": "Source available but not yet ingested",
      "established_trail_routes": "Unknown",
      "trail_network": "Unknown",
      "access_points": "Unknown",
      "scenic_roads": "Unknown",
      "transport_connections": "Unknown",
      "dynamic_conditions": "Unknown",
      "names_localization": "Source available but not yet ingested",
      "accessibility": "Unknown",
      "licensing_provenance": "Source available but not yet ingested",
      "sensitive_location_controls": "Unknown"
    },
    "japan_national_sources": {
      "protected_areas": "Source available but not yet ingested",
      "natural_features": "Source available but not yet ingested",
      "established_trail_routes": "Unknown",
      "trail_network": "Unknown",
      "access_points": "Unknown",
      "scenic_roads": "Unknown",
      "transport_connections": "Source available but not yet ingested",
      "dynamic_conditions": "Source available but not yet ingested",
      "names_localization": "Source available but not yet ingested",
      "accessibility": "Unknown",
      "licensing_provenance": "Source available but not yet ingested",
      "sensitive_location_controls": "Unknown"
    },
    "norway_sources": {
      "protected_areas": "Source available but not yet ingested",
      "natural_features": "Source available but not yet ingested",
      "established_trail_routes": "Source available but not yet ingested",
      "trail_network": "Source available but not yet ingested",
      "access_points": "Unknown",
      "scenic_roads": "Unknown",
      "transport_connections": "Unknown",
      "dynamic_conditions": "Source available but not yet ingested",
      "names_localization": "Source available but not yet ingested",
      "accessibility": "Unknown",
      "licensing_provenance": "Source available but not yet ingested",
      "sensitive_location_controls": "Unknown"
    },
    "switzerland_sources": {
      "protected_areas": "Source available but not yet ingested",
      "natural_features": "Source available but not yet ingested",
      "established_trail_routes": "Source available but not yet ingested",
      "trail_network": "Source available but not yet ingested",
      "access_points": "Unknown",
      "scenic_roads": "Unknown",
      "transport_connections": "Source available but not yet ingested",
      "dynamic_conditions": "Source available but not yet ingested",
      "names_localization": "Source available but not yet ingested",
      "accessibility": "Unknown",
      "licensing_provenance": "Source available but not yet ingested",
      "sensitive_location_controls": "Unknown"
    },
    "structural_only": {
      "protected_areas": "Structurally supported but unpopulated",
      "natural_features": "Structurally supported but unpopulated",
      "established_trail_routes": "Structurally supported but unpopulated",
      "trail_network": "Structurally supported but unpopulated",
      "access_points": "Structurally supported but unpopulated",
      "scenic_roads": "Structurally supported but unpopulated",
      "transport_connections": "Structurally supported but unpopulated",
      "dynamic_conditions": "Structurally supported but unpopulated",
      "names_localization": "Structurally supported but unpopulated",
      "accessibility": "Structurally supported but unpopulated",
      "licensing_provenance": "Structurally supported but unpopulated",
      "sensitive_location_controls": "Structurally supported but unpopulated"
    },
    "excluded": {
      "protected_areas": "Excluded, with reason",
      "natural_features": "Excluded, with reason",
      "established_trail_routes": "Excluded, with reason",
      "trail_network": "Excluded, with reason",
      "access_points": "Excluded, with reason",
      "scenic_roads": "Excluded, with reason",
      "transport_connections": "Excluded, with reason",
      "dynamic_conditions": "Excluded, with reason",
      "names_localization": "Excluded, with reason",
      "accessibility": "Excluded, with reason",
      "licensing_provenance": "Excluded, with reason",
      "sensitive_location_controls": "Excluded, with reason"
    }
  },
  "sourceProfiles": {
    "none": [],
    "global_reference": ["osm-global", "wikidata", "wikimedia-commons"],
    "eu_base": ["eea-natura-2000", "inspire-geoportal", "osm-global", "wikidata"],
    "uk_base": ["uk-jncc-protected-areas", "uk-os-open-data", "uk-naptan", "osm-global", "wikidata"],
    "scotland": ["uk-jncc-protected-areas", "uk-os-open-data", "uk-naptan", "scotland-core-paths", "scotland-naturescot-data", "scotland-traffic", "scotland-sais", "osm-global", "wikidata"],
    "wales": ["uk-jncc-protected-areas", "uk-os-open-data", "uk-naptan", "wales-datamap", "osm-global", "wikidata"],
    "northern_ireland": ["uk-jncc-protected-areas", "ni-open-data", "ni-daera-natural-heritage", "osm-global", "wikidata"],
    "us_federal": ["usgs-pad-us", "usgs-gnis", "usgs-national-digital-trails", "usfs-enterprise-data", "nps-data-api", "osm-global", "wikidata"],
    "canada_federal": ["canada-cpcad", "canada-open-maps", "canada-cgndb", "osm-global", "wikidata"],
    "japan_national": ["japan-gsi", "japan-gsi-gazetteer", "japan-mlit-national-land", "japan-moe-national-parks", "japan-jma-hazards", "osm-global", "wikidata"],
    "norway_national": ["norway-kartverket", "norway-naturbase", "norway-turrutebasen", "norway-nve-hazards", "norway-npra-datex", "osm-global", "wikidata"],
    "switzerland_national": ["switzerland-swisstopo-ogd", "switzerland-swissnames3d", "switzerland-mobility-routes", "switzerland-slf-avalanche", "switzerland-public-transport-gtfs", "osm-global", "wikidata"]
  },
  "jurisdictions": [